Category,SubCategory,CatID,CatShort,Explanations,Synonyms - Comma Separated,Category_zh,SubCategory_zh,Synonyms_zh
LEATHER,MOVEMENT,LETHRMvmt,LETHR,"Movement of Leather, definitely overlap with LEATHER-CREAK and LEATHER-HANDLE.","flap, flop, rustle, mvmt, slide",皮革,移动,扇动、抖动、沙沙声、移动、滑动
LIQUID & MUD,BUBBLES,LIQBubl,LIQ,"Mud and thicker than water, thick bubbles, viscous liquid. Things like Oil, gloopy thick liquids.","bubble, foam, pop, mud",液体与流体,气泡,气泡、泡沫、砰的一声、泥
LIQUID & MUD,IMPACT,LIQImpt,LIQ,"Mud and thicker than water, Splats and hit. Things like Oil, gloopy thick liquids.","splat, splatter, hit, impact, plop, kerplunk, plunk, mud",液体与流体,打击,滴落、飞溅、击中、撞击、扑通、噗通、砰砰、泥
LIQUID & MUD,MISC,LIQMisc,LIQ,Mud and thicker than water sounds not fitting another category in this list.,miscellaneous,液体与流体,其他,各种各样的
LIQUID & MUD,MOVEMENT,LIQMvmt,LIQ,"Mud and thicker than water, oozing, slime, glooping. Things like Oil, gloopy thick liquids.","ooze, slime, goo, mud",液体与流体,移动,软泥、粘液、粘性物、泥
LIQUID & MUD,SUCTION,LIQSuct,LIQ,"Thicker than water, disgusting liquidy suction, plunger sucks. Things like Oil, gloopy thick liquids.","suction, slurp, glomp, plunger, mud",液体与流体,咕嘟,吸、啜食、咕噜声、活塞、皮搋、泥浆
MACHINES,AMUSEMENT,MACHAmus,MACH,Theme park rides such as rollercoasters and carnival rides. Carnival game machines. General ambiences to go in AMBIENCE-AMUSEMENT.,"rollercoaster, merry-go-round, scrambler, tilt-a-whirl, kiddy ride, theme park ride, pinball, skeeball",机器,娱乐,过山车、旋转木马、爬梯、旋转椅、儿童骑行、主题公园小火车、弹球、滚球
MACHINES,ANTIQUE,MACHAntq,MACH,"Old mechanical sewing machines, ancient looms, olive presses, a bit ambiguous but a very old mechanical machine.","printing press, sewing machine, olive press, butter churn",机器,老式的,印刷机、缝纫机、橄榄压榨机、黄油搅拌机
MACHINES,APPLIANCE,MACHAppl,MACH,"General appliances, refrigerator, stove, oven, vacuum cleaner... AC and fans have their own category.","oven, fridge, refrigerator, blender, food processor, hair dryer, ice maker, washing machine, dryer, iron, coffee maker, dishwasher, electric can opener, garbage disposal, humidifier, dehumidifier, sewing machine, toaster, waffle maker, griddle, hot plate",机器,家电,烤箱、冰柜、冰箱、搅拌机、食物料理机、吹风机、制冰机、洗衣机、烘干机、熨斗、咖啡机、洗碗机、电动开罐器、垃圾处理机、加湿器、除湿机、缝纫机、烤面包机、华夫饼机、煎锅、烤盘
MACHINES,CONSTRUCTION,MACHCnst,MACH,"A machine for construction that isn't a vehicle or a tool. For example a cement mixer, a woodchipper.","crane, cement mixer, wood chipper",机器,施工,起重机、水泥搅拌机、碎木机
MACHINES,ELEVATOR,MACHElev,MACH,Elevator movement and doors would go here.,"paternoster, freight elevator, passenger elevator, lift",机器,电梯,帕特诺斯特、货运电梯、乘客电梯、电梯
MACHINES,ESCALATOR,MACHEscl,MACH,Escalators and moving walkways would go here.,"travelator, moving walkway",机器,自动扶梯,传送带、自动人行道
MACHINES,FAN,MACHFan,MACH,"Fans of all types, box fans, ceiling fans. For air conditioning use MACHINES-HVAC.","fan, ceiling fan, box fan, industrial fan, bladeless fan",机器,风扇,风扇、吊扇、箱式风扇、工业风扇、无叶风扇
MACHINES,GARDEN,MACHGrdn,MACH,"Powered landscaping machines, lawnmowers, weed-whackers, edgers, hedge trimmers. See also TOOLS-GARDEN and OBJECTS-GARDEN.","lawnmower, weedwhacker, edger, chainsaw, trimmer, polesaw, mulcher, cultivator",机器,花园,割草机、除草机、磨边机、锯子、修剪机、杆链锯、覆盖机、耕种机
MACHINES,GYM,MACHGym,MACH,"Exercise bikes, weight machines, treadmill, all things fitness. See also OBJECTS-GYM","treadmill, eliptical, rowing machine, exercise bike, stationary bike, nordictrack, stair climber.",机器,健身房,跑步机、踏步机、划船机、健身自行车、健身脚踏车、诺迪克跑步机、踏步台阶机。
MACHINES,HITECH,MACHTech,MACH,"Think cool James Bond machines, big elaborate death traps, maybe Rube Goldberg type machines. See also SCIFI-MACHINE.","gadget, digital, handheld",机器,高科技,小工具、数码、手持
MACHINES,HVAC,MACHHvac,MACH,"Furnaces, Air Conditioners. Fans go in MACHINES-FAN. A close up gas furnace flame would go to FIRE-GAS.","aircon, air conditioning, heating.",机器,空调,空调、冷风机、暖气。
MACHINES,INDUSTRIAL,MACHInd,MACH,"Big industrial presses, factory machines, industrial robots, any heavy manufacturing machines.","hydraulic press, assembly line, distillery, punch press, form press+F437:F450",机器,工业,液压机、装配线、流水线、酿酒厂、蒸馏机、冲床、压力机
MACHINES,MECHANISM,MACHMech,MACH,"Complex mechanical smaller machines and gadgets, puzzle boxes that open portals to hell. Usually smaller devices.","puzzle box, rube goldberg, gizmo",机器,装置,拼图盒、谜盒、谜箱、鲁布·戈德堡、小玩意
MACHINES,MEDICAL,MACHMed,MACH,"Machines typically found in a hospital, medical lab or Doctor's office.","x-ray machines, mri, cat scan, pet scan, blood pressure machine, lab test machine, centrifuge, ventilator, defibrillator",机器,医疗,X 光机、核磁共振、CT机、照影机、血压仪、实验室测试机、离心机、呼吸机、除颤器
MACHINES,MISC,MACHMisc,MACH,Machine sounds not fitting another category in this list. See also MOTOR category.,miscellaneous,机器,其他,各种各样的
MACHINES,OFFICE,MACHOffc,MACH,"Machines typically found in an office, such as printers and copy machines.","fax machine, facsimile machine, telefax, copy machine, printer, shredder, xerox, photocopier, mimeograph, laser printer, inkjet, paper shredder, plotter",机器,办公设备,传真机、传真电话、电报、复印机、打印机、碎纸机、施乐、影印机、油印机、激光打印机、喷墨打印机、粉碎机、绘图仪
MACHINES,PUMP,MACHPump,MACH,"Air or water pumps, fish tank aquarium pumps, sump pumps. Air compressors would fall into this category.","water pump, sump pump, compressor, air compressor",机器,泵,水泵、污水泵、压缩机、空气压缩机
MAGIC,ANGELIC,MAGAngl,MAG,"Angelic, Holy, Benevolent magic. The opposite of evil. Think choral tones and healing magic.","holy, celestial, ethereal, divine, spiritual, beatific, righteous, saintly",魔法,天使,神圣的、天上的、空灵的、神的、精神的、祝福的、正义的、圣洁的
MAGIC,ELEMENTAL,MAGElem,MAG,"Magic centered around elements, fire, water, ice. Think the movie Frozen type stuff.","fire, water, earth, electric, air, wind",魔法,元素,火、水、土、电、气、风
MAGIC,EVIL,MAGEvil,MAG,"Evil magic, ominous, dark magic. Voldemort type stuff.","dark, devil, summon, necromancy, voodoo, black magic, forbidden",魔法,邪恶,黑暗、恶魔、召唤、死灵法术、巫毒术、黑魔法、禁止、禁术
MAGIC,MISC,MAGMisc,MAG,Magic sounds not fitting another category in this list.,miscellaneous,魔法,杂项,各种各样的
MAGIC,POOF,MAGPoof,MAG,"Shorter magic phrases, often for transforming, short 'turn you into a rabbit' type stuff.","chuff, foomp, blast",魔法,噗,噗的一声、砰的一声、爆破声
MAGIC,SHIMMER,MAGShim,MAG,"Glassy or chime-like shimmers, waves of particle type magic.","twinkle, sparkle, bell tree, chime, glint, glisten, glitter, scintillation, glow, glimmer, gleam",魔法,闪耀,闪烁、闪闪发光、树铃、风铃、闪耀、闪光、闪亮、火花、发光、微光、反光
MAGIC,SPELL,MAGSpel,MAG,Something complex for a spell being cast. Think Maleficent swirling green magic or weird vocal-ish spells.,"witch, wizard, sorcerer, cast, incantation, hex, rune, sorcery, enchant, invocation, bewitch, exorcism, curse, trance",魔法,咒语,女巫、巫师、魔术师、施法、咒语、妖术、符文、魔法、附魔、祈求、祈祷、蛊惑、驱魔、诅咒、恍惚、魅惑
MECHANICAL,CLICK,MECHClik,MECH,"Short clicks, could be from button presses, things like that. Some confusion and overlap with MECHANICAL-SWITCH.","click, clack, snap, toggle, button",机械,咔哒,单击、按、咔哒声、卡合、切换、按钮
MECHANICAL,GEARS,MECHGear,MECH,"A toothed cog, turning or grinding gears, complex gear mechanisms. Small clock gears would go in CLOCKS-MECHANICS.","gear, cog, pinion, rack and pinion, transmission, cogwheel, gearwheel, flywheel",机械,齿轮,齿轮、嵌齿轮、小齿轮、齿条、齿轮、传动装置、轮齿、大齿轮、飞轮
MECHANICAL,HYDRAULIC & PNEUMATIC,MECHHydr,MECH,"Various hydraulic or pneumatic sounds, like on a self-closing door. Isolated hydraulics and pneumatics. See also DOORS-HYDRAULIC & PNEUMATIC for a complete door.","hydraulic, pneumatic, pressurized, valve",机械,液压与气动,液压、气动、加压、阀门
MECHANICAL,LATCH,MECHLtch,MECH,"Latch, as in a briefcase latch, or a luggage latch.","latch, hardware, lock, clasp, hasp, bolt",机械,插销,闩锁、硬件、五金、锁、扣、搭扣、螺栓
MECHANICAL,LEVER,MECHLvr,MECH,"A sliding or switching lever. Train track lever, lever to turn on an electric chair. Old Frankenstein machine levers, breaker levers.","lever, switch, clunk, clank",机械,操纵杆,杠杆、开关、撞击声、叮当声
MECHANICAL,LOCK,MECHLock,MECH,"A padlock, bicycle lock, or a locking mechanism. Door locks to go into DOORS-HARDWARE.","padlock, deadbolt",机械,锁,挂锁、死锁、门栓
MECHANICAL,MISC,MECHMisc,MECH,Mechanical sounds not fitting another category in this list.,miscellaneous,机械,杂项,各种各样的
MECHANICAL,PULLEY,MECHPuly,MECH,"An isolated recording of a pulley, or system of pulleys.","squeak, chirp, roll",机械,滑轮,吱吱声、叽叽喳喳、滚动
MECHANICAL,RATCHET,MECHRtch,MECH,That sound a ratchet makes.,"ratchet, snap, click, wind, crank, winch",机械,棘轮,棘轮、卡扣、按、上发条、曲柄、绞盘
MECHANICAL,RELAY,MECHRelay,MECH,Old train station counting board flipping. A old communications relay board.,"flip, toggle, clack",机械,传动,翻转、切换、敲击
MECHANICAL,ROLLER,MECHRolr,MECH,"Like a rolling conveyor belt, or something on a roller.","roll, belt, lineshaft",机械,滚筒,转动、传送带、线轴、卷轴
MECHANICAL,SWITCH,MECHSwtch,MECH,"Basic and heavy switches, light switches, power switches. Some overlap or confusion with MECHANICAL-CLICK.","switch, click, clack, toggle, button",机械,开关,切换、点击、咔哒声、切换、按钮
METAL,BREAK,METLBrk,METL,"Metal breaking, snaps, cracks, rips, shatters.","break, crack, rip, shatter, crunch",金属,打碎,断裂、裂开、撕裂、碎裂、紧缩、压碎
METAL,CRASH & DEBRIS,METLCrsh,METL,"Metal crashing and debris. Complex metal crashes, group metal crashes, metal debris falls.","crash, fall, debris",金属,碎片,碰撞、坠落、碎片
METAL,FRICTION,METLFric,METL,"Metal friction, stress, so scrapes, creaks, squeaks, squeals, screeches. Metal sounds caused by friction.","stress, scrape, creak, squeak, screech",金属,挤压,压力、刮擦、吱吱声、吱吱声、尖叫声
METAL,HANDLE,METLHndl,METL,"Metal handling, handling metal objects. Some overlap with METAL-MOVEMENT possible.","handle, grab, set, pickup, set down, toss, catch",金属,抓取,拿、抓、放置、拿起、放下、扔、接
METAL,IMPACT,METLImpt,METL,"Metal single item impacts, so anvil hits, dropping something that doesn't break. Clangs, clunks, bangs.","hit, drop, impact, crash, clunk, clang",金属,打击,击中、掉落、撞击、碰撞、撞击声、叮当声
METAL,MISC,METLMisc,METL,Metal sounds not fitting another category in this list.,miscellaneous,金属,其他,各种各样的
METAL,MOVEMENT,METLMvmt,METL,"Metal movement, so drag, roll, rattle, shake. Single or metal items moving. Or movement on a metal surface. See also METAL-HANDLE.","drag, roll, rattle, shake",金属,移动,拖动、拖拽、滚动、嘎拉嘎拉、摇晃
METAL,TONAL,METLTonl,METL,"Metal tonal, resonating, ringing, wronks and warps. Bending sheet metal, a singing bowl ringing, metal shinging.","bow, ring, wronk, shing, warp, bend, resonate",金属,音乐性,弓箭、铃、怪的、噌的一声、缠绕、弯曲、共鸣
MOTORS,ANTIQUE,MOTRAntq,MOTR,"Old motors, usually combustion, so old oil pump engines, old compressors. An antique gas pump for example.","kerosene engine, paraffin engine",马达,老式的,煤油发动机、石蜡发动机
MOTORS,COMBUSTION,MOTRComb,MOTR,"Non-vehicle combustion engines. Combustion motors, generators. Isolated engine recordings.","diesel engine, gas engine, combustion engine, two-stroke engine",马达,内燃机,柴油发动机、燃气发动机、内燃机、二冲程发动机
MOTORS,ELECTRIC,MOTRElec,MOTR,Non-vehicle electric motors. Any motor that runs on electricity. An isolated electric motor. See also TOOLS-POWER.,"toothbrush, electric razor, electric motor, garbage disposal, dentist drill",马达,电动的,牙刷、电动剃须刀、电动马达、垃圾处理器、牙医钻头
MOTORS,MISC,MOTRMisc,MOTR,Motor sounds not fitting another category in this list.,miscellaneous,马达,其他,各种各样的
MOTORS,SERVO,MOTRSrvo,MOTR,"Specifically servo motors, from robot, to radio controlled servos. Clean isolated servos.","robot, rc car, camera focus, car antenna, printer",马达,伺服电机,机器人、遥控车、相机对焦、汽车天线、打印机
MOTORS,TURBINE,MOTRTurb,MOTR,"Turbines, water or air. That classic 'whine' power up and down are usually turbines. A jet engine is a turbine.","windmill, airplane, aircraft, generator",马达,涡轮,风车、飞机、飞行器、发电机
MOVEMENT,ACTIVITY,MOVEActv,MOVE,"Crowds moving but also performing activities, cleaning, moving boxes. Clean recordings with no vocals. See MOVEMENT-HUMAN for Single activity.","activity, moving, cleaning, shopping, unpacking",移动,人类活动,活动、搬家、清洁、购物、开箱
MOVEMENT,ANIMAL,MOVEAnml,MOVE,"Group animal movement, individual feet go to FOOTSTEPS-ANIMAL or FOOTSTEPS-HORSE. But think herds of grazing animals, stampedes.","stampede, herd, charge, trample, scramble",移动,动物,踩踏、放牧、冲锋、践踏、争夺
MOVEMENT,CREATURE,MOVECrea,MOVE,"Slithering Dragons, Gooey Zombie Movement.","slither, crawl, slide, squirm, wriggle",移动,生物,滑行、爬行、滑动、蠕动、扭动
MOVEMENT,CROWD,MOVECrwd,MOVE,Groups of people milling or walking. Usually mostly just recordings of group footsteps in real locations. No vocals. Compare to MOVEMENT-ACTIVITY.,"walk, run, march, mill, shuffle, scuffle, sit, stand, lie, slip, jump, skip",移动,人群,走、跑、齐步走、闲逛、滑步、扭打、坐、站、躺、滑、跳、蹦
MOVEMENT,HUMAN,MOVEHmn,MOVE,"Movement of single human, aside from footsteps, standing, sitting, shuffe. Some overlap or confusion with FOOTSTEP-HUMAN or MOVEMENT-ACTIVITY.","walk, run, march, mill, shuffle, scuffle, sit, stand, lie, slip, jump, skip",移动,人类,走、跑、齐步走、闲逛、滑步、扭打、坐、站、躺、滑、跳、蹦
MOVEMENT,INSECT,MOVEInsc,MOVE,"Group insects, footsteps, movement, swarms, spiders, locusts. Swarms of flying insects here too, bees, flies. Overlap with ANIMALS-INSECT or AMBIENCE-INSECT.","swarm, hive, beehive, slither, maggots",移动,昆虫,蜂群、蜂巢、蜂箱、蠕动、蛆虫
MOVEMENT,MISC,MOVEMisc,MOVE,Movement sounds not fitting another category in this list.,miscellaneous,移动,其他,各种各样的
MOVEMENT,PRESENCE,MOVEPres,MOVE,"Very light movement, people in church adjusting, people on church pews. Again, recordings without vocals. Compare to MOVEMENT-ACTIVITY and MOVEMENT-CROWD.","adjust, shuffle, scuffle, light movement, shift",移动,社会活动,调整、侧滑、拖着、轻微移动、转移
MUSICAL,BELLS,MUSCBell,MUSC,"Specifically musical bells, tuned bells, think Tubular bells or hand bells. See also the BELL category for non-musical uses. BELL-GONG is older and this is a better fit.","tubular bells, carillon, gamelan, singing bowl, hand bell, cowbell, gong, gamelan, agung, bowl gong, tam-tam",乐句,钟铃,管铃、钟琴、甘美兰、颂钵、手摇铃、牛铃、锣、gamelan、阿贡锣、碗锣、tam-tam
MUSICAL,BRASS,MUSCBrass,MUSC,"Brass musical instruments, trumpets, tuba, french horn.","tuba, french horn, trombone, trumpet, mellophone, euphorium, sousaphone, flugelhorn, bugle, saxhorn, cornet",乐句,铜管,大号、圆号、长号、小号、木管、行进圆号、大号、长号、号角、萨克斯管、短号
MUSICAL,CHIME,MUSCChim,MUSC,"Wind chimes, bell trees, Tinkerbell type magic chimes.","wind chime, bell tree, tinkle, twinkle, shimmer",乐句,钟铃,风铃、树铃、铃铛、闪烁、闪光
MUSICAL,CHORAL,MUSCChor,MUSC,"Choir pieces, choral, not for 'designed type vocally stuff'.","choir, choral, gospel, church",乐句,合唱,合唱团、唱诗班、福音、教堂
MUSICAL,EXPERIMENTAL,MUSCExpr,MUSC,"Strange or wierdly modified instruments, exotic instruments, prepared instruments like a prepared piano.","theremin, glass armonica, pyrophone, stylophone, cristal baschet, electrified cactus, aeolian wind harp",乐句,实验,特雷门琴、玻璃琴、火风琴、斯特乐风迷你笔触琴、水晶琴、电动跳舞仙人掌、风弦琴
MUSICAL,INSTRUMENT,MUSCInst,MUSC,Various instruments that don't have a home in the other MUSICAL categories.,instrument,乐句,器乐曲,乐器
MUSICAL,KEYED,MUSCKeyd,MUSC,"Keyed Instruments, such as pianos and harpsichord. For synthesizer though see MUSICAL-SYNTHESIZED.","piano, organ, harpsicord, accordian, melodica, celesta, spinet, clavinet, clavichord, harmonium, dulcitone",乐句,键控,钢琴、管风琴、大键琴、手风琴、口风琴、钢片琴、斯平纳琴、电翼琴、小键琴、风琴、杜西冬琴
MUSICAL,LOOP,MUSCLoop,MUSC,"For looping musical phrases, sampled loops.","music loops, sample loops, drum loops",乐句,循环,音乐循环、采样循环、鼓循环
MUSICAL,MISC,MUSCMisc,MUSC,Music sounds not fitting another category in this list. Hopefully rarely needed.,"miscellaneous, harmonica, kazoo",乐句,杂项,各种各样的、口琴、卡祖笛
MUSICAL,PERCUSSION,MUSCPerc,MUSC,"Drums and percussion, including deep timpani or big war drums. Mainly meant for true membrane instruments, also see MUSICAL-TUNED PERCUSSION","timpani, kettle drum, bass drum, toms, war drums, taiko, kick drum, snare drum",乐句,打击,定音鼓、锅鼓、低音鼓、筒鼓、战鼓、太鼓、底鼓、军鼓
MUSICAL,PERCUSSION TUNED,MUSCTnprc,MUSC,"Tuned percussion mostly played with mallets, Xylophones, Vibraphones, etc.","glockenspiel, xylophone, vibraphone, metallophone,  bell lyre, steel drum, marimba",乐句,打击乐,钟琴、木琴、颤音琴、铁琴、里拉铁片琴、钢鼓、马林巴琴
MUSICAL,PERFORMANCE,MUSCPrfm,MUSC,"A musical performance, or warm-up, a live musical act, a street musican, high school band. If a mixed ambience, look to AMBIENCE categories, like PUBLIC PLACE.","band, street musician, live concert, show, nightclub, ",乐句,表演,乐队、街头音乐家、现场音乐会、演出、夜总会
MUSICAL,PLUCKED,MUSCPluck,MUSC,"Guitars, Banjos, Harps, instruments that are mainly plucked when played. See also MUSICAL-STRINGED.","guitar, banjo, ukelele, harp, acoustic guitar, bass guitar, mandolin,  balalaika, sitar, pipa, thumb piano, jaw harp, zither, balalaika, autoharp, kora, lute, lyre, oud, tambura, karimba",乐句,拨弦乐,吉他、班卓琴、尤克里里、竖琴、原声吉他、电贝斯、曼陀铃、巴拉莱卡琴、西塔琴、琵琶、拇指琴、口簧琴、古筝、巴拉莱卡琴、自动竖琴、科拉琴、鲁特琴、里拉琴、乌德琴、坦布拉琴、卡林巴
MUSICAL,SAMPLE,MUSCSmpl,MUSC,"Musical samples. Single triggered samples, not loops, which has its own subcategory here.","samples, raw samples, one-shot",乐句,采样,采样、原始采样、单次
MUSICAL,SHAKEN,MUSCShake,MUSC,"Shaken musical instruments, rattles, tamourines.","maracas, tambourine, rattles, rainstick, shekere , egg shaker, chajchas, monkey stick, katsa, sistrum, shaker, cabasa",乐句,沙棒,沙锤、铃鼓、拨浪鼓、雨声器、椰铃、沙蛋、羊蹄拨浪鼓、拉格琴、katsa、摇铃、沙鈴、铁沙铃
MUSICAL,SONG & PHRASE,MUSCSong,MUSC,"Complete musical pieces, songs as ringtones, car music bys. See also MUSICAL-PERFORMANCE which is a better fit for 'live performances'.","music, player piano, ringtone, musical car by, phrase",乐句,段子,音乐、自动演奏钢琴、铃声、汽车音响、乐句
MUSICAL,STINGER,MUSCStngr,MUSC,"A short musical phrase or accent, like a horror 'string' sting. A big pitching cello note. But musical in nature.","music sting, news sting, title",乐句,重击音,音乐短乐句、新闻短乐句、标题乐句
MUSICAL,STRINGED,MUSCStr,MUSC,"Bowed string instruments like violin, cello, viola. Harp probably now goes to MUSICAL-PLUCKED.","violin, cello, viola, violoncello, bass, double bass",乐句,弦乐,小提琴、大提琴、中提琴、大提琴、低音、低音提琴、竖琴
MUSICAL,SYNTHESIZED,MUSCSynth,MUSC,"Synth samples, musical synth performances. Some overlap with MUSICAL-SAMPLE, but this meant for more than simple triggered samples.","synth, moog, casio, roland, arp, synthesizer, oberheim, minimoog, yamaha, korg",乐句,合成器,合成、穆格、卡西欧、罗兰、琶音、合成器、oberheim、迷你穆格、雅马哈、科音
MUSICAL,TOY,MUSCToy,MUSC,"Toys that play musical phrases, also music boxes would go here.","music box, jack in the box",乐句,玩具,音乐盒、八音盒
MUSICAL,WOODWIND,MUSCWind,MUSC,"Woodwind instruments like flute, oboe, bassoon, clarinet.","flute, piccolo, oboe, bassoon, recorder, clarinet, saxophone, bass clarinet, ney, bansuri, kaval, pan flute, xiao, fife, ",乐句,木管,长笛、短笛、双簧管、巴松管、录音机（竖笛）、单簧管、萨克斯管、低音单簧管、纳伊笛、印度班苏里笛、卡瓦尔木笛、排箫、箫 、菲菲笛
NATURAL DISASTER,AVALANCHE,NATDAval,NATD,"Composite big movements of sliding, falling earth, landslides, mudslides. This category often for big hollywood versions of these types of sound.","landslide, mudslide",自然灾害,雪崩,塌方、泥石流
NATURAL DISASTER,EARTHQUAKE,NATDQuak,NATD,Composite and complex earthquake rumbles and rattles. This category often for big hollywood versions of these types of sound.,"earthquake, rumble, rattle, fissure, lfe",自然灾害,地震,地震、隆隆声、隆隆作响、裂缝、低频声
NATURAL DISASTER,MISC,NATDMisc,NATD,Natural Disaster sounds not fitting another category in this list.,miscellaneous,自然灾害,其他,各种各样的
NATURAL DISASTER,TORNADO,NATDTorn,NATD,"Composite tornado sounds, layered and created massive tornadoes. This category often for big hollywood versions of these types of sound.","twister, vortex, waterspout",自然灾害,龙卷风,龙卷风、漩涡、水龙卷、龙吸水
NATURAL DISASTER,TSUNAMI,NATDTsun,NATD,"Composite tidal wave or tsunami scenes, layered and created. This category often for big hollywood versions of these types of sound.","tidal wave, tsunami",自然灾害,热带风暴,浪潮、海啸
NATURAL DISASTER,TYPHOON,NATDThyp,NATD,"Composite typhoons, cyclones or hurricanes. Massive swirling storms. This category often for big hollywood versions of these types of sound.","typhoon, hurricane, cyclone, tropical storm",自然灾害,台风,台风、飓风、旋风、热带风暴
NATURAL DISASTER,VOLCANO,NATDVolc,NATD,"Composite big volcano eruptions. Lava, lava bombs, eruptions. This category often for big hollywood versions of these types of sound. See also GEOTHERMAL-LAVA.","eruption, lava, lava bombs, eruptions, pyroclast",自然灾害,火山喷发,喷发、熔岩、岩浆、熔岩炸弹、火山爆发、火山碎屑
OBJECTS,BAG,OBJBag,OBJ,"Bags and purses, shopping bags, lunch bags. Really any bag, except Luggage which would go to OBJECTS-LUGGAGE.","duffle, backpack, back pack, purse, handbag, shoulder bag, camera bag",物件,袋子,行李箱、双肩包、背包、钱包、手提包、单肩包、相机包
OBJECTS,BOOK,OBJBook,OBJ,"Books, magazines, sounds relating to these. Handling particularly. Some overlap or confusion with PAPER-HANDLE.","book, cover, magazine, catalog, textbook, dictionary, tome, volume, bible, publication",物件,书籍,书、封面、杂志、目录、教科书、字典、册、卷、圣经、出版
OBJECTS,COIN,OBJCoin,OBJ,"Coins land, toss, drop, handle. Coins being counted, sorted. A bag of coins.","toss, flip, ping, dump, spin, piggy bank, clink, coinage, loose change, change, silver dollar, penny, nickel, dime, quarter",物件,硬币,扔、翻、碰、丢、旋转、存钱罐、碰杯、叮当声、硬币、零钱、钢镚儿、银币、便士、五分钱、一毛钱、两毛五
OBJECTS,CONTAINER,OBJCont,OBJ,"Boxes, tupperware, jewelry boxes, things that hold things, lids, handling, opens and closes.","box, carboard box, container, package, jewelly box, plastic container, lid, tupperware, capsule, breadbox, canister, toolbox, pill box",物件,箱盒,盒子、硬纸盒、容器、包裹、珠宝盒、塑料容器、盖子、特百惠、胶囊、面包箱、罐、工具箱、药盒
