Category,SubCategory,CatID,CatShort,Explanations,Synonyms - Comma Separated,Category_zh,SubCategory_zh,Synonyms_zh
OBJECTS,FASHION,OBJFash,OBJ,"Shoes, belts, clothes, actions involding fashion objects. Makeup, lipstick, etc. Some overlap possible with CLOTH categories. See also OBJECTS-JEWELRY. And OBJECTS-BAG.","shoes, boots, mascara, lipstick, makeup, belt, sash, scarf, high-heels, eyeliner, sunglasses, glasses, wallet, hat, gloves, watches, shawl, socks, bandana, headband, ties, muffs, suspenders, robe, hankerchief",物件,花园,鞋子、靴子、睫毛膏、口红、化妆品、腰带、饰带、围巾、高跟鞋、眼线笔、太阳镜、眼镜、钱包、帽子、手套、手表、披肩、袜子、大手帕、发带、领带、套袖、背带、长袍、手绢
OBJECTS,FURNITURE,OBJFurn,OBJ,"Chairs movement, couch movement, things like that. Wood chair creaks could go in WOOD-FRICTION.","chesterfield, sofa, rocking chair, table, chair, loveseat, stool, cabinet, bookcase, bed, couch, chest",物件,健身房,真皮沙发、沙发、摇椅、桌子、椅子、双人沙发、凳子、柜子、书柜、床、长椅、箱子
OBJECTS,GARDEN,OBJGrdn,OBJ,"Flower pots, bird feeders, things that you might find and use in a garden. See also TOOLS-GARDEN and MACHINES-GARDEN.","flower pot, garden sculpture, hose, faucet, watering can, bird feeder, composter",物件,时尚,花盆、花园雕塑、水管、水龙头、喷壶、喂鸟器、堆肥器
OBJECTS,GYM,OBJGym,OBJ,"Objects found in a fitness center or school gym, maybe a yoga mat, dumbells. See also MACHINES-GYM.","weight, dumbell, barbell, mat, weight bench, jumprope, exercise ball, yoga mat, weight bench, resistance band, kettlebell, fitness ball, exercise ball",物件,家具,力量器械、哑铃、杠铃、垫子、举重床、跳绳、健身球、瑜伽垫、推举椅、阻力带、壶铃、健身球、练习球
OBJECTS,HOUSEHOLD,OBJHsehld,OBJ,"Cleaning products, hangers, towel racks, things around the house that don't fit somewhere else.","domestic, home, house",物件,家用品,家用的、家、房子
OBJECTS,JEWELRY,OBJJewl,OBJ,"Bracelets, necklaces, rings.","bracelet, necklace, crown, earing, ring, nosering, pendant, tie pin, cufflinks",物件,珠宝首饰,手链、手镯、项链、皇冠、耳环、戒指、鼻饰、吊坠、领带针、袖扣
OBJECTS,KEYS,OBJKey,OBJ,"Keys jingling, keys movement in lock.","keyring, keychain, lanyard",物件,钥匙,钥匙圈、钥匙扣、挂绳
OBJECTS,LUGGAGE,OBJLug,OBJ,"Suitcases, luggage related sounds, handling, opening, packing.","suitcase, baggage, duffel bag, duffel",物件,行李,手提箱、行李、行李袋、行李箱
OBJECTS,MEDICAL,OBJMed,OBJ,Common objects in hospital or medical office.,"manual blood pressure meter, stethoscope, rubber gloves, clamp, syringe, forcep",物件,医疗,手动血压计、听诊器、橡胶手套、夹子、注射器、镊子
OBJECTS,MISC,OBJMisc,OBJ,Object sounds not fitting another category in this list.,miscellaneous,物件,其他,各种各样的
OBJECTS,OFFICE,OBJOffc,OBJ,"Things found in an office, staplers, paper cutter etc. Not machines like a printer which would go in MACHINES-OFFICE.","stapler, paper cutter, hole punch, scissors, paper tray, paperweight, folder, binder, report",物件,办公设备,订书机、裁纸机、打孔机、剪刀、纸托盘、压纸器、文件夹、活页夹、文件
OBJECTS,PACKAGING,OBJPack,OBJ,"Items commonly used in packaging or packing, so bubblewrap, styrofoam, labels, food packaging.","cardboard, styrofoam, packing peanuts, labels, packing paper, bubblewrap",物件,包装品,纸板、泡沫聚苯乙烯、泡沫填充物、标签、包装纸、泡沫包装
OBJECTS,TAPE,OBJTape,OBJ,Tape and other tacky sticky type sounds as well. Velco probably better into CLOTH-RIP as that matches the 'sound' better.,"tape, velcro, flypaper, glue, packing tape, masking tape, duct tape, gaffer tape, scotch tape, double stick tape",物件,胶带制品,胶带、魔术贴、防蝇纸、胶水、包装胶带、美纹纸胶带、胶布、电工胶带、透明胶带、双面胶带
OBJECTS,UMBRELLA,OBJUmbr,OBJ,"Umbrella opens and closes. Not for rain on umbrella, which would go in RAIN-CLOTH.","shake, rustle, pop, thump",物件,伞,摇晃、沙沙声、砰砰声
OBJECTS,WHEELED,OBJWhled,OBJ,"Non-motorized wheeled carts and dollies. Shopping cart, food cart, baggage cart, baby stroller, dolly, wheelchairs.","pram, perambulator, baby carriage, wheelchair, dolly, stroller, cart, gurney",物件,有轮制品,婴儿车、手推车)、轮椅、婴儿推车、手推车、搬运车、轮床
OBJECTS,WRITING,OBJWrite,OBJ,"Any writing object or performance of writing on any surface. Pens, pencils, crayons, markers.","pen, pencil, marker, chalk, crayon, dry erase board, sharpie, signature",物件,书写用品,钢笔、铅笔、记号笔、粉笔、蜡笔、白板笔、签字笔
OBJECTS,ZIPPER,OBJZipr,OBJ,"Pant zippers, bag zippers, luggage zippers.","zipper, pants, jacket, tent, bag",物件,拉链,拉链、裤子、夹克、帐篷、包
PAPER,FLUTTER,PAPRFltr,PAPR,"Paper and Cardboard. Tossing a group of pages or a book in the air, money flutters as it falls to the ground. Confetti.","flutter, flap, fall, confetti, cardboard, paper",纸张,抖动,颤动、襟翼、坠落、五彩纸屑、纸板、纸
PAPER,FRICTION,PAPRFric,PAPR,Paper and Cardboard. Sliding paper or scraping paper.,"sliding, scraping, cardboard, paper",纸张,碰撞,滑动、刮擦、纸板、纸
PAPER,HANDLE,PAPRHndl,PAPR,"Paper and Cardboard. Page turns, magazine handling. Books dropping. Handling paper money. Some overlap or confusion with OBJECTS-BOOK.","turn, page, flip, browse, peruse, cardboard, paper",纸张,手持噪音,翻、翻页、翻页、浏览、细读、纸板、纸
PAPER,IMPACT,PAPRImpt,PAPR,"Paper and Cardboard. Heavy paper hits, a rolled up newspaper thwack, a magazine hitting something.","paper hit, smack, slap, newspaper, magazine, cardboard, paper",纸张,摩擦,纸张击打、拍击、巴掌、报纸、杂志、纸板、纸
PAPER,MISC,PAPRMisc,PAPR,Paper and Cardboard. Paper sounds not fitting another category in this list.,miscellaneous,纸张,杂项,各种各样的
PAPER,RIP,PAPRRip,PAPR,"Paper and Cardboard. Ripping paper, paper tears.","tear, rip, shred, cardboard, paper",纸张,撕扯,撕裂、撕裂、撕碎、纸板、纸
PAPER,TONAL,PAPRTonl,PAPR,"Paper and Cardboard. Not very common, but tonal paper sounds.","tonal, singing, ringing, paper, cardboard",纸张,音乐性,音调、歌唱、铃声、纸、纸板
PLASTIC,BREAK,PLASBrk,PLAS,"Plastic breaking, crunches, rips, shatters.","break, crack, rip, shatter, crunch",塑料,打碎,打破、裂缝、撕裂、粉碎、紧缩
PLASTIC,CRASH & DEBRIS,PLASCrsh,PLAS,"Plastic crashing, groups items falling, group destruction, plastic debris.","fall, crash, debris",塑料,碎片,坠落、坠毁、碎片
PLASTIC,FRICTION,PLASFric,PLAS,"Plastic friction, such as scrapes, creaks, squeaks, screeching.","stress, scrape, creaks, squeaks, screech",塑料,挤压,压力、刮擦、剐蹭、吱吱声、尖叫声
PLASTIC,HANDLE,PLASHndl,PLAS,"Plastic handling, handling a toy or remote control. Some overlap with PLASTIC-MOVEMENT possible.","handle, grab, set, pickup, set down, toss, catch",塑料,抓取,把手、手柄、抓握、放置、拾起、放下、抛掷、握住
PLASTIC,IMPACT,PLASImpt,PLAS,"Plastic item impact. Hit, drop, big plastic impacts where item does not break. Dropping a plastic object.","hit, drop, impact",塑料,打击,撞击、掉落、撞击、摔打
PLASTIC,MISC,PLASMisc,PLAS,Plastic sounds not fitting another category in this list.,miscellaneous,塑料,其他,各种各样的
PLASTIC,MOVEMENT,PLASMvmt,PLAS,"Plastic movement, dragging plastic or drag on plastic, rattles, shakes. See also PLASTIC-HANDLE.","drag, roll, rattle, shake",塑料,移动,拖动、滚动、摇晃、摇晃
PLASTIC,TONAL,PLASTonl,PLAS,"Plastic tonal sounds, with a musical quality. Probably pretty rare.","tonal, singing, ringing",塑料,音乐性,拨尺子、拨塑料、弹塑料、玩塑料、塑料乐器
RAIN,CLOTH,RAINClth,RAIN,"Rain on cloth, like a person's clothes, or more likely a patio umbrella, awning.","rain, cloth, jacket, umbrella, cotton",雨,布料,涼篷、雨篷、布、夹克、伞、棉
RAIN,CONCRETE,RAINConc,RAIN,Rain on asphalt or concrete or patio tile. Rain on a hard slappy solid surface.,"rain, cement, pavement, asphalt",雨,水泥,雨水、水泥、路面、沥青、瓷砖、岩石
RAIN,GENERAL,RAIN,RAIN,"General downpour, rain on mixed materials.","rain, rainstorm, downpour",雨,通用,雨、暴雨、倾盆大雨
RAIN,GLASS,RAINGlas,RAIN,"Rain on a glass roof like a sunroof, or rain blown against a window as well.","rain, glass, skylight, window, sunroof, greenhouse",雨,玻璃,雨、玻璃、天窗、窗户、遮阳顶、温室
RAIN,INTERIOR,RAINInt,RAIN,"Interior recordings of Rain, from inside house or barn, or vehicle.","rain, rainstorm, interior rain, windhield rain, rain on roof",雨,车内,雨、暴雨、室内雨、挡风玻璃雨、屋顶雨
RAIN,METAL,RAINMetl,RAIN,"Rain on a metal surface, so exterior rain on a car, or metal sheet, metal roof.","rain, metal, car, can, tin, roof",雨,金属,雨、金属、汽车、罐头、铁皮、屋顶
RAIN,PLASTIC,RAINPlas,RAIN,"Rain on plastic or vinyl surfaces, like a grill cover, or a plastic shed.","rain, plastic, vinyl, plexiglass",雨,塑料,雨、塑料、乙烯基、有机玻璃
RAIN,VEGETATION,RAINVege,RAIN,"Rain on plants, leaves and grass. Jungle or tropical rain on plant leaves.","Rain on a metal surface, so rain on a car, or metal sheet, etc.",雨,植物,雨水落在植物、树叶和草地上、丛林或热带雨林的雨水落在植物叶子上
RAIN,WATER,RAINWatr,RAIN,"Rain on water, puddles, lakes, ponds.","rain, puddle, lake, pond",雨,水,雨、水坑、湖泊、池塘
RAIN,WOOD,RAINWood,RAIN,"Rain on wood surfaces, so a deck for example.","rain, wood, deck, roof, shed, floor",雨,木质,雨、木、甲板、屋顶、棚、地板
ROBOTS,MISC,ROBTMisc,ROBT,Robot sounds not fitting another category in this list.,"automaton, droid, bot",机器人,杂项,自动机、机器人、机器人
ROBOTS,MOVEMENT,ROBTMvmt,ROBT,"Complex robot movement, servos, possible robot hovering and flying. See also MOTORS-SERVO.","servo, solenoid, mechanism, pneumatic, hydraulic, droid, bot",机器人,运动,伺服、螺线管、机械、气动、液压、机器人、机器人
ROBOTS,VOCAL,ROBTVox,ROBT,"Droid and robot vocals, R2D2 would go here. Any manner of vocalizing robot. More expressive than a beep/UI.","droid, chirp, beep, whistle, bot",机器人,语音,机器人、啁啾、哔哔声、口哨声、机器人
ROCKS,BREAK,ROCKBrk,ROCK,"Rock cracks, breaks, rips or shatters. More isolated and singular cracks and breaks.","Breaks, Cracks, Rips, Shatters, Crunches",岩石,打碎,断裂、裂缝、撕裂、破碎、嘎吱
ROCKS,CRASH & DEBRIS,ROCKCrsh,ROCK,"Rock crashes and debris, so a huge rock crash, collapse. Or isolated debris. See also NATURAL DISASTER-AVALANCHE.","Fall, Debris",岩石,碎片,掉落、碎片
ROCKS,FRICTION,ROCKFric,ROCK,"Rock creaks, scrapes... the stress of rock about to break.","Stress, Scrapes, Creaks, Squeaks, Screech",岩石,挤压,压力、擦伤、嘎吱、吱吱声、吱吱声
ROCKS,HANDLE,ROCKHndl,ROCK,"Rock handing, picking up or digging through rocks, bricks. Some overlap with ROCKS-MOVEMENT possible.","handle, grab, set, pickup, set down, toss, catch",岩石,抓取,挖掘机、抓握、放置、拾起、放下、抛掷、握住
ROCKS,IMPACT,ROCKImpt,ROCK,"Rock falling, dropping without breaking, or something hit with a rock, a big rock impact.","Hit, Drop, Impact, Crash, Clunk, Clang, Clink, Chop",岩石,打击,击中、掉落、撞击、跌落、哐啷、撞击声、叮当、猛击
ROCKS,MISC,ROCKMisc,ROCK,Rock sounds not fitting another category in this list.,miscellaneous,岩石,其他,各种各样的
ROCKS,MOVEMENT,ROCKMvmt,ROCK,"Rock dragging, or dragging across a rock surface, rocks shaking or rattling. See also ROCKS-HANDLE.","Drag, Roll, Rattle, Shake",岩石,移动,拖动、滚动、嘎嘎声、摇晃
ROCKS,TONAL,ROCKTonl,ROCK,"Tonal rocks, probably pretty rare. Singing rocks.","Bowed, Ring, Wronk, Shing, Warp",岩石,音乐性,弓、石质乐器、玩石头、
ROPE,CREAK,ROPECreak,ROPE,"Rope stretches and creaks, people hanging from nooses.. Ship rope creaks. Tension of rope stretches.","stretch, tension, pull",绳索,作响,拉伸、拉紧、拉扯
ROPE,HANDLE,ROPEHndl,ROPE,"Rope handling, tying knots, rigging up a ship sail. Possible overlap with ROPE-MOVEMENT.","handle, grab, set, pickup, set down, toss, catch",绳索,抓取,抓握、放置、拾起、放下、抛掷、握住
ROPE,IMPACT,ROPEImpt,ROPE,"Rope impacts, tossing ropes to ground, ropes banging violently in the wind. Possible overlap with ROPE-MOVEMENT.","hit, drop, impact",绳索,打击,抽打、击中、掉落、撞击
ROPE,MISC,ROPEMisc,ROPE,Rope sounds not fitting another category in this list.,miscellaneous,绳索,杂项,各种各样的
ROPE,MOVEMENT,ROPEMvmt,ROPE,"Ropes zuzzing, moving across objects, zipline. See also ROPE-HANDLE.","zuzz, zipline, zip, knot, tie",绳索,移动,滑索、拉链、结、领带
RUBBER,CRASH & DEBRIS,RUBRCrsh,RUBR,"Rubber items crashing, or rubber debris landing.","debris, scatter, plop",橡胶,碎片,碎片、分散、扑通
RUBBER,FRICTION,RUBRFric,RUBR,"Rubber squeaks, balloon squeaks, a rubber shoe squeak.","squeak, creak, drag, rub, scrape, groan",橡胶,挤压,吱吱声、拖拽、摩擦、刮擦、压力
RUBBER,HANDLE,RUBRHndl,RUBR,"Rubber handling, rubber objects being manipulated or handled. Some overlap with RUBBER-MOVEMENT","handle, grab, set, pickup, set down, toss, catch",橡胶,抓取,抓握、放置、拾起、放下、抛掷、握住
RUBBER,IMPACT,RUBRImpt,RUBR,"Rubber impacts, drops, bounces. Hitting a balloon or rubber ball.","smack, impact, hit, bounce, drop",橡胶,打击,敲击、撞击、弹跳、掉落
RUBBER,MISC,RUBRMisc,RUBR,Rubber sounds not fitting another category in this list.,miscellaneous,橡胶,其他,各种各样的
RUBBER,MOVEMENT,RUBRMvmt,RUBR,"Rubber movement, dragging rubber or drag on rubber. Rubber flapping. See also RUBBER-HANDLE.","movement, drag, flap, flop",橡胶,移动,移动、拖拽、拍打、落下
RUBBER,TONAL,RUBRTonl,RUBR,"Rubber movement with a tonal quality, a musical quality.","tonal, rubber, singing",橡胶,音乐性,音调、橡胶、歌唱
SCIFI,ALARM,SCIAlrm,SCI,"Overly futuristic alarms, the kind you're hear on a spaceship","sci-fi alarm, alert, warning",科幻,警报,科幻警报、警报、警告
SCIFI,COMPUTER,SCICmpt,SCI,"Use Sci-Fi for overtly 'science fiction' type computer sounds, a very futuristic computer. Some overlap with USER INTERFACE.","computer, console, interface, holoscreen",科幻,电脑,计算机、控制台、界面、全屏
SCIFI,DOOR,SCIDoor,SCI,That Star-Trek type door. Spaceship doors.,"sci-fi door, airlock",科幻,门,科幻门、气闸
SCIFI,ENERGY,SCIEnrg,SCI,"Energy particles, vortexes, transporters, holograms, force fields.","particle, vortex, transporter, hologram, force field",科幻,能量,粒子、涡流、转运体、全息图、力场
SCIFI,IMPACT,SCIImpt,SCI,"A bolt of SciFi energy, a hi-tech energy impact, more futuristic than just an explosion. Overlap with DESIGNED-IMPACT.","energy hit, energy wave, force field",科幻,打击,能量冲击、波浪能、力场
SCIFI,MACHINE,SCIMach,SCI,"Future technology machines, transporters, food replicators.","teleporter, food replicators, holodeck",科幻,机械,传送器、食物复制器、全息成像、平台
SCIFI,MECHANISM,SCIMech,SCI,An overly sci-fi sounding gizmo or mechanism. Little unfolding robot or something like that. Similar to MACHINE-MECHANISM but more SciFi.,"tricorder, scifi device, gizmo",科幻,机械设备,三录仪、科幻设备、小发明
SCIFI,MISC,SCIMisc,SCI,SCI-FI sounds not fitting another category in this list.,miscellaneous,科幻,其他,各种各样的
SCIFI,RETRO,SCIRetro,SCI,"Cheesy sci-fi sounds, like from The Jetsons, The Day the Earth Stood Still. Old TV or film sci-fi sounds.",old sci-fi,科幻,复古,老式科幻
SCIFI,SPACESHIP,SCIShip,SCI,"Spaceships here, your best Enterprise and Tie Fighter rip-offs! See also SCIFI-VEHICLE for non-spaceships.","spaceship, ufo, mothership, battlecruiser, starship",科幻,太空船,宇宙飞船、不明飞行物、母舰、战列巡洋舰、星舰
SCIFI,VEHICLE,SCIVeh,SCI,"Various sci-fi vehicles, like a moon rover, landspeeder, speeder bike, hoverboard, podracer. See also SCIFI-SPACESHIP.","moon rover, landspeeder, speeder bike, hoverboard, podracer",科幻,载具,月球车、陆行艇、超速自行车、悬浮滑板、飞梭赛车
SCIFI,WEAPON,SCIWeap,SCI,"Lightsabers, exotic sci-fi weapons. Not a 'blaster' which would go in LASERS-GUN.","lightsabers, exotic weapon",科幻,武器,光剑、异种武器
SNOW,CRASH & DEBRIS,SNOWCrsh,SNOW,"Snow big crashes, a big fall of snow, a roof full of snow collapsing. See also NATURAL DISASTER-AVALANCE for the extreme version of this.","snowball, snow crash",雪,碎片,雪球、雪崩
SNOW,FRICTION,SNOWFric,SNOW,"Snow scrapes, squeaks. Sliing on snow, sledding.","stress, scrape, creak, squeak, screech",雪,挤压,压力、刮擦、吱吱声、吱吱声、尖啸
SNOW,HANDLE,SNOWHndl,SNOW,"Snow being handled, a snowball being formed, etc. Digging out of show with your hands. Some overlap with SNOW-MOVEMENT.","handle, grab, set, pickup, set down, toss, catch",雪,抓取,抓握、放置、拾起、放下、抛掷、握住
SNOW,IMPACT,SNOWImpt,SNOW,"A big impact of snow, like a roof full of snow falling. Or smaller like a snowball. Jumping into a pile of snow.","snowball, snow drift, topple, fall",雪,打击,雪球、雪飘、倾倒、飘落
SNOW,MISC,SNOWMisc,SNOW,Snow sounds not fitting another category in this list.,miscellaneous,雪,杂项,各种各样的
SNOW,MOVEMENT,SNOWMvmt,SNOW,"Dragging something through snow, rolling in snow. See also SNOW-HANDLE.","wade, drag, plow, fumble",雪,移动,涉水、拖拽、犁地、摸索
SPORTS,COURT,SPRTCourt,SPRT,"Sports played on a court indoors or out, such a basketball, tennis.","basketball, tennis, fencing, volleyball, racquetball, badminton, netball, squash, dodgeball, shuffleboard, handball",运动,球类运动,篮球、网球、击剑、排球、壁球、羽毛球、无板篮球、壁球、躲避球、沙狐球、手球
SPORTS,FIELD,SPRTField,SPRT,Sports played on a field outdoors such as soccer and football.,"soccer, football, baseball, field hockey, cricket, rugby, polo, lacrosse",运动,户外运动,足球、橄榄球、棒球、曲棍球、板球、橄榄球、马球、长曲棍球
SPORTS,GYM,SPRTGym,SPRT,"Sports played or performed primarily in a gym and/or ring, such as boxing, wrestling, gymnastics. See also SPORTS-INDOOR.","boxing, wrestling, gymnastics, weight training, martial arts, karate, judo, tae kwon do, dojo, kung fu",运动,健身,拳击、摔跤、体操、重量训练、武术、空手道、柔道、跆拳道、柔道、功夫
SPORTS,INDOOR,SPRTIndor,SPRT,Various indoor sports not able to be categorized elsewhere.,"bowling, billiards, ping pong, darts",运动,室内运动,保龄球、台球、乒乓球、飞镖
SPORTS,MISC,SPRTMisc,SPRT,Sport sounds not fitting another category in this list.,golf,运动,其他,高尔夫球
SPORTS,SKATE,SPRTSkate,SPRT,"Wheeled skating sports like skateboarding or roller skating, rollerblading.","skateboarding, roller skating, rollerblading, push scooter",运动,冰上运动,滑板、轮滑、旱冰、滑板车
SPORTS,TRACK & FIELD,SPRTTrck,SPRT,"Track and field sports, as in running, long jump, pole vault. Think common summer Olympic games.","long jump, running, pole vault, shot put, javelin throw",运动,田径,跳远、跑步、撑杆跳、铅球、标枪投掷
SPORTS,WATER,SPRTWatr,SPRT,"Sports played in or on water, swimming, diving. Aquatic sports.","swimming, water polo, water volleyball, diving, water skiing, surfing, kiteboarding, scuba, snorkeling",运动,水上运动,游泳、水球、水排球、潜水、滑水、冲浪、风筝冲浪、水肺潜水、浮潜
SPORTS,WINTER,SPRTWntr,SPRT,"Sports on snow or ice such as hockey, ice skating, snowboard and skiing.","skiing, snowboarding, bobsledding, ice skating, sledding, curling, ice hockey, luge, speed skating",运动,冬季运动,滑雪、单板滑雪、雪橇、滑冰、雪橇、冰壶、冰球、雪橇、速度滑冰
SWOOSHES,SWISH,SWSH,SWSH,"A swish is smaller than a Whoosh. Arm Swishes, Sword Swishes. Small objects make Swishes.","swish, kungfu, whizby, flutter, swing",嗖嗖声,嗖嗖声,嗖嗖、武术、呼啸而过、颤振、摇摆
SWOOSHES,WHOOSH,WHSH,WHSH,"A whoosh is larger than a swish. A large object would make a Whoosh. Tanks flying over your head, or an asteroid by. See also DESIGNED-WHOOSH for very stylized whooshes.",woosh,呼呼声,呼呼声,呜呜
TOOLS,GARDEN,TOOLGrdn,TOOL,"Hand tools used in a garden, rakes, hoes, etc. Also see MACHINES-GARDEN for powered machines. See also OBJECTS-GARDEN for non-tools.","rake, hoe, spade, trowel, broom, pruning sheer, garden fork, tiller, loppers, shovel, weeder",工具,,耙子、锄头、铁锹、泥铲、扫把、修剪剪刀、花园叉、分蘖、园艺剪、铲子、除草机
TOOLS,HAND,TOOLHand,TOOL,"Hand tools, not requiring power. Hammers, wrenches, pliers. See also TOOLS-GARDEN.","hammer, screwdriver, pliers, wrench, ratchet, socket, hand saw, clamp, cutter, pry bar, chisel, scraper, staple gun, file, scissors",工具,手持,锤子、螺丝刀、钳子、扳手、棘轮、插座、手锯、夹钳、刀具、撬棒、凿子、刮刀、钉枪、锉刀、剪刀
TOOLS,MISC,TOOLMisc,TOOL,Tool sounds not fitting another category in this list.,miscellaneous,工具,其他,各种各样的
TOOLS,PNEUMATIC,TOOLPneu,TOOL,"Air tools, such as jackhammers, air ratchets, nail guns. The air-wrench sound in a tire shop.","jackhammer, air tool, air ratchet, nail guns",工具,气动,手提钻、气动工具、气动棘轮、射钉枪
TOOLS,POWER,TOOLPowr,TOOL,"Tools that require power. A sander, electric drill, dremel tool, circular saw.","drill, power saw, circular saw, jigsaw, sander, belt sander, router, power screwdriver, heat gun, drill press, table saw",工具,电动,钻头、电锯、圆锯、线锯、砂光机、砂带机、槽刨机、电动螺丝刀、热风枪
TOYS,ELECTRONIC,TOYElec,TOY,"Remote controlled car, slot cars. Any kids toy that required power. See also AIRCRAFT-REMOTE CONTROLLED.","remote controlled car, slot car, speak and spell, furby",玩具,电动,遥控车、老虎机、语音益智玩具、电子宠物
TOYS,MECHANICAL,TOYMech,TOY,"Wind up robots, things like that. Toys with some mechanism or mechanical component.","windup toy, toy robot, winding toy",玩具,机械,发条玩具、玩具机器人、发条玩具
TOYS,MISC,TOYMisc,TOY,Toy sounds not fitting another category in this list.,"action figure, doll, stuffed animal",玩具,杂项,动作人偶、娃娃、毛绒动物
TRAINS,BRAKE,TRNBrake,TRN,"Screeching metalic train brake wheels, subway brakes. Usually a piercing sound.","breaks, screech, grind",火车,刹车,断裂、尖叫、摩擦
TRAINS,CLACK,TRNClak,TRN,"Train clacks isolated, constant clacking of trains passing or running.",clack,火车,哐当,噼啪
TRAINS,DOOR,TRNDoor,TRN,"Train doors, sliding doors in passenger or freight trains. Some overlap with general DOORS category and possibly VEHICLES-DOOR.","train door, subway door",火车,门,火车门、地铁门、自动门
TRAINS,DIESEL,TRNDiesl,TRN,"Freight trains, large commercial diesel locomotives.",diesel train,火车,内燃机车,柴油火车
TRAINS,ELECTRIC,TRNElec,TRN,"Commuter trains, elevated trains, light rail, SUBWAYS have their own category.","commuter train, regional train, city line, inter-city train, light rail",火车,电力机车,通勤列车、区域列车、城市线、城际列车、轻轨
TRAINS,HIGH SPEED,TRNHspd,TRN,"Hi-Tech trains, Maglev, monorails, Hyperloops, bullet trains.","hi-tech train, maglev, monorails, hyperloop, bullet train",火车,高速列车,高科技列车、磁悬浮列车、单轨列车、超级高铁、子弹头列车
TRAINS,HORN,TRNHorn,TRN,"Train horns, subway horns. A steam train whistle would likely go into WHISTLES-MECHANICAL.","train horn, subway horn",火车,鸣笛,火车喇叭、地铁喇叭
TRAINS,INTERIOR,TRNInt,TRN,"Interior trains, from Diesel to Commuter, onboard train sounds.","commuter train, regional train, city line, inter-city train, light rail, freight train, subway, monorail",火车,车厢内,通勤列车、区域列车、城市线、城际列车、轻轨、货运列车、地铁、单轨列车
TRAINS,MECHANISM,TRNMech,TRN,"Coupling, decoupling and other mechanical sounds relating to trains. Levers, coal tender mechanics that are specific to a train.","shunt, decouple",火车,机械,分流、解耦
TRAINS,MISC,TRNMisc,TRN,Train sounds not fitting another category in this list.,miscellaneous,火车,杂项,各种各样的
TRAINS,STEAM,TRNSteam,TRN,"Old steam powered trains, big smoke stack chugs.","steam train, coal train",火车,蒸汽火车,蒸汽火车、煤炭火车
TRAINS,SUBWAY,TRNSbwy,TRN,"Subways, overtly 'underground' sounding trains, above group city trains probably best in TRAINS-ELECTRIC","metro, subway, the tube, rer",火车,地铁,地铁、地铁、管、快速铁路
TRAINS,TRAM,TRNTram,TRN,"Trolleys, cable cars trams and streetcars. A Tram is 'pulled' along a cable, so not self-powered. An electric tram would go to TRAINS-ELECTRIC.","tram, trolley, cable car, funicular, grip car",火车,电车,电车、电车、缆车、索道缆车、抓地车
